housing_affordability_index,housing_af,numeric,✔,,,"Housing Affordability Index (HAI) measures the ability of a typical resident to purchase a home in the geographic area. The HAI has a base of 100, representing where the median income is sufficient to qualify for a loan on a median-valued home and not be cost-burdened (cost-burdened=greater than 30% of income spent on housing). HAI values > 100 indicate increasing affordability; HAI values < 100 indicate areas where homes are less affordable and median income might be insufficient to purchase a median-valued home. This attribute is calculated at the Census Block Group in which the parcel is located. Source: US Census Bureau via ESRI. Updated each July representing previous year.",15.0,150
population_density,population,numeric,✔,,,"Estimate of the Population Density (population per Square Mile) in the geographic area. Population density is computed by dividing the total population within the geographic area by the total land area, measured in square miles. This attribute is calculated at the Census Block Group in which the parcel is located. Source: US Census Bureau via ESRI. Updated each July representing previous year.",15.0,151
population_growth_past_5_years,populati_1,numeric,✔,,,"Population Compound Annual Growth Rate (CAGR) for the previous 5 year period, is an annualized measure describing the direction (either positive or negative) and magnitude of change in the total number of persons between the previous 5 years. Annualized means that the resultant value reflects a rate of change over a twelve-month time period. This permits analysis of multiple growth rates between values measured at differing points in time using a common time period of twelve months; the annualized growth rate is repeated, or compounded, each year. The CAGR is sometimes referred to as growth rate, annual rate, annualized growth rate, or compound growth rate. This attribute is calculated at the Census Block Group in which the parcel is located. Source: US Census Bureau via ESRI. Updated each July representing previous year.  These values are expressed as percentages and should be read as-is. For example, a value of 0.15 represents 0.15%, not 15%. Further details can be found on the Esri Location Data Dictionary: https://doc.arcgis.com/en/esri-demographics/latest/reference/essential-vocabulary.htm",15.0,152
population_growth_next_5_years,populati_2,numeric,✔,,,"Five-year forecast for Population Growth: Compound Annual Growth Rate (CAGR). The Population Growth CAGR is an annualized measure that describes the direction (either positive or negative) and magnitude of change in population between the current year and that year plus 5. The CAGR is sometimes referred to as growth rate, annual rate, annualized growth rate, or compound growth rate. This attribute is calculated at the Census Block Group in which the parcel is located. Source: US Census Bureau via ESRI. Updated each July representing previous year.  These values are expressed as percentages and should be read as-is. For example, a value of 0.15 represents 0.15%, not 15%. Further details can be found on the Esri Location Data Dictionary: https://doc.arcgis.com/en/esri-demographics/latest/reference/essential-vocabulary.htm",15.0,153
housing_growth_past_5_years,housing_gr,numeric,✔,,,"Housing Units Compound Annual Growth Rate (CAGR) for the previous five year period, is an annualized measure describing the direction (either positive or negative) and magnitude of change in the total number of housing units between the previous 5 years. Annualized means that the resultant value reflects a rate of change over a twelve-month time period. This permits analysis of multiple growth rates between values measured at differing points in time using a common time period of twelve months; the annualized growth rate is repeated, or compounded, each year. The CAGR is sometimes referred to as growth rate, annual rate, annualized growth rate, or compound growth rate. This attribute is calculated at the Census Block Group in which the parcel is located. Source: US Census Bureau via ESRI. Updated each July representing previous year.  These values are expressed as percentages and should be read as-is. For example, a value of 0.15 represents 0.15%, not 15%. Further details can be found on the Esri Location Data Dictionary: https://doc.arcgis.com/en/esri-demographics/latest/reference/essential-vocabulary.htm",15.0,154
housing_growth_next_5_years,housing__1,numeric,✔,,,"Five-year forecast for Housing Units: Compound Annual Growth Rate (CAGR). The Housing Unit CAGR is an annualized measure that describes the direction (either positive or negative) and magnitude of change in total housing units between the current year and that year plus 5. The CAGR is sometimes referred to as growth rate, annual rate, annualized growth rate, or compound growth rate. This attribute is calculated at the Census Block Group in which the parcel is located. Source: US Census Bureau via ESRI. Updated each July representing previous year.  These values are expressed as percentages and should be read as-is. For example, a value of 0.15 represents 0.15%, not 15%. Further details can be found on the Esri Location Data Dictionary: https://doc.arcgis.com/en/esri-demographics/latest/reference/essential-vocabulary.htm",15.0,155
household_income_growth_next_5_years,household_,numeric,✔,,,"Five-year forecast for Median Household Income: Compound Annual Growth Rate (CAGR). The Median Household Income CAGR is an annualized measure that describes the direction (either positive or negative) and magnitude of change in the total Median Household Income between the current year and that year plus 5. The CAGR is sometimes referred to as growth rate, annual rate, annualized growth rate, or compound growth rate. This attribute is calculated at the Census Block Group in which the parcel is located. Source: US Census Bureau via ESRI. Updated each July representing previous year.  These values are expressed as percentages and should be read as-is. For example, a value of 0.15 represents 0.15%, not 15%. Further details can be found on the Esri Location Data Dictionary: https://doc.arcgis.com/en/esri-demographics/latest/reference/essential-vocabulary.htm",15.0,156
median_household_income,median_hou,numeric,✔,,,"Estimate of Median Household Income in the geographic area for the previous year. Median Household Income is the amount that divides household income (annual income for all household earners age 15+) into two equal groups in a geographic area; half of the population will have income higher than the median and half will have lower income. If the median falls in the upper income interval of $200,000+, it is represented by the value of $200,001. Esri uses the U.S. Census definition of income. This attribute is calculated at the Census Block Group in which the parcel is located. Source: US Census Bureau via ESRI. Updated each July representing previous year.",15.0,157
transmission_line_distance,transmissi,numeric,✔,,,Sourced from HIFLD; provides the distance in meters from the parcel boundary to the nearest relatively high voltage (69kv - 765kv) electric transmission line as available within the Homeland Infrastructure Foundation-Level Data (HIFLD) Transmission Line dataset (https://hifld-geoplatform.hub.arcgis.com/datasets/geoplatform::transmission-lines/about),15.0,158
roughness_rating,roughness_,numeric,✔,,,"The amount of elevation variability within a parcel. Calculated per parcel from Digital Elevation Model (DEM).
0 = a level terrain surface
1 = a nearly level terrain surface
2 = a slightly rugged terrain surface
3 = an intermediately rugged terrain surface
4 = a moderately rugged terrain surface
5 = a highly rugged terrain surface
6 = an extremely rugged terrain surface
Additional details at: https://support.regrid.com/parcel-data/parcel-elevation-faq",15.0,159
highest_parcel_elevation,highest_pa,numeric,✔,,,"Highest elevation value (meters) intersecting the parcel calculated using best available terrain data. Calculated for each parcel
Additional details at: https://support.regrid.com/parcel-data/parcel-elevation-faq",15.0,160
lowest_parcel_elevation,lowest_par,numeric,✔,,,"Lowest elevation value (meters) intersecting the parcel calculated using best available terrain data. Calculated for each parcel.
Additional details at: https://support.regrid.com/parcel-data/parcel-elevation-faq",15.0,161